040401,25186,"Boulettes au porc et au boeuf (à la suédoise)s, crues"
040401,25194,"Boulettes au boeuf et à l'agneau (type kefta)s, crues"
040401,25504,Brochette de volaille
040401,25505,Brochette de boeuf
040401,25506,Brochette mixte de viande
040401,25512,"Volaille, croquette panée ou nuggets"
040401,25541,Brochette d'agneau
040401,25566,"Brochette de porc, crue"
040401,36027,"Poulet, croquette panée ou nuggets"
040401,36035,"Poulet, manchons marinés, rôtis/cuits au four"
040401,36036,"Poulet, escalope panée"
040401,36318,"Dinde, escalope viennoise ou milanaise ou escalope panée"
040501,25996,"Saumon, cuit, sans précision (aliment moyen)"
040501,25997,"Cabillaud, cuit, sans précision (aliment moyen)"
040501,25998,"Hareng fumé, filet, doux"
040501,26003,"Carrelet ou plie, cuit à la vapeur"
040501,26008,"Églefin, cuit à la vapeur"
040501,26012,"Hareng, frit"
040501,26013,"Hareng fumé, au naturel"
040501,26014,"Hareng, grillé/poêlé"
040501,26015,"Lieu noir, cuit"
040501,26017,"Limande0sole, cuite à la vapeur"
040501,26019,"Maquereau, rôti/cuit au four"
040501,26020,"Maquereau, frit"
040501,26021,"Merlan, frit"
040501,26022,"Merlan, cuit à la vapeur"
040501,26023,"Cabillaud, rôti/cuit au four"
040501,26024,"Morue, salée, bouillie/cuite à l'eau"
040501,26025,"Cabillaud, cuit à la vapeur"
040501,26026,"Mulet, rôti/cuit au four"
040501,26031,"Raie, rôtie/cuite au four"
040501,26033,"Roussette ou petite roussette ou saumonette, cuite"
040501,26037,Saumon fumé
040501,26038,"Saumon, cuit à la vapeur"
040501,26041,"Thon, rôti/cuit au four"
040501,26059,"Sole, cuite à la vapeur"
040501,26060,"Sole, rôtie/cuite au four"
040501,26061,"Sole, bouillie/cuite à l'eau"
040501,26062,"Sole, frite"
040501,26073,"Raie, cuite au court0bouillon"
040501,26081,"Lotte ou baudroie, grillée/poêlée"
040501,26087,"Maquereau, fumé"
040501,26090,Haddock (fumé) ou églefin fumé
040501,26093,"Espadon, rôti/cuit au four"
040501,26094,"Turbot, rôti/cuit au four"
040501,26120,"Merlu, cuit à l'étouffée"
040501,26126,"Églefin, grillé/poêlé"
040501,26136,"Sardine, grillée"
040501,26147,"Vivaneau, cuit"
040501,26148,"Rascasse, cuite à la vapeur"
040501,26152,"Lieu ou colin d'Alaska, fumé"
040501,26192,"Lieu jaune ou colin, cuit"
040501,26211,"Saumon, cuit au micro0ondes, élevage"
040501,26217,"Saumon, bouilli/cuit à l'eau, élevage"
040501,26222,"Dorade grise, ou daurade grise, ou griset, rôtie/cuite au four"
040501,26229,"Saumon, grillé/poêlé"
040501,26230,"Saumon, élevage, rôti/cuit au four"
040501,26232,"Hareng fumé, à l'huile"
040501,26234,"Julienne ou Lingue, cuite"
040501,26247,"Flétan du Groënland ou flétan noir ou flétan commun, cuit à la vapeur"
040501,26248,"Sole, poêlée"
040501,26999,"Anguille, cuite (aliment moyen)"
040501,27000,"Anguille, rôtie/cuite au four"
040501,27001,"Anguille, bouillie/cuite à l'eau"
040501,27002,"Brochet, rôti/cuit au four"
040501,27004,"Carpe, rôtie/cuite au four"
040501,27005,"Perche, rôtie/cuite au four"
040501,27006,"Truite, rôtie/cuite au four"
040501,27007,"Truite, cuite à la vapeur"
040501,27014,"Truite arc en ciel, élevage, rôtie/cuite au four"
040501,27015,"Truite arc en ciel, élevage, cuite à la vapeur"
040501,27018,"Panga, Pangasius, ou poisson0chat du Mékong, filet, cuit"
040501,27029,"Truite d'élevage, fumée"
040501,27030,"Bar commun ou loup, rôti/cuit au four"
040501,27031,"Dorade (Daurade) royale, cuite au four"
040601,26001,"Bar rayé ou bar d'Amérique, cru"
040601,26006,"Lieu ou colin d'Alaska, cru"
040601,26009,"Flétan de l'Atlantique ou flétan blanc, cru"
040601,26011,"Hareng, cru"
040601,26018,"Lotte ou baudroie, crue"
040601,26036,"Saumon, cru, élevage"
040601,26042,"Turbot sauvage, cru"
040601,26043,"Cabillaud, cru"
040601,26044,"Merlu, cru"
040601,26047,"Lieu noir, surgelé, cru"
040601,26048,"Merlu, filet, surgelé, cru"
040601,26051,"Maquereau, cru"
040601,26052,"Raie, crue"
040601,26053,"Thon, cru"
040601,26055,"Carrelet ou plie, cru"
040601,26057,"Limande, crue"
040601,26058,"Sole, crue"
040601,26063,"Rascasse, crue"
040601,26064,"Thon albacore ou thon jaune, cru"
040601,26065,"Sardine, crue"
040601,26068,"Thon listao ou Bonite à ventre rayé, cru"
040601,26069,"Thon rouge, cru"
040601,26072,"Bar commun ou loup, cru, sans précision"
040601,26074,"Roussette ou petite roussette ou saumonette, crue"
040601,26075,"Bar ou loup de l'Atlantique, cru"
040601,26076,"Thon germon ou thon blanc, cru"
040601,26079,"Anchois commun, cru"
040601,26080,"Dorade royale, ou daurade ou vraie daurade, crue, sauvage"
040601,26082,"Espadon, cru"
040601,26083,"Éperlan, cru"
040601,26084,"Cardine franche, crue"
040601,26085,"Rouget0barbet de roche, cru"
040601,26088,"Dorade royale ou daurade ou vraie daurade, crue, élevage"
040601,26091,"Mulet, cru"
040601,26092,"Truite de mer, crue"
040601,26095,"Merlan, cru"
040601,26098,"Morue, salée, sèche"
040601,26099,"Dorade grise, ou daurade grise, ou griset, crue"
040601,26100,"Bogue, crue"
040601,26101,"Bonite, crue"
040601,26102,"Maquereau espagnol ou maquereau blanc ou billard, cru"
040601,26103,"Denté, cru"
040601,26104,"Saint0Pierre, cru"
040601,26106,"Grondin, cru"
040601,26107,"Corb, cru"
040601,26108,"Capelan, cru"
040601,26109,"Dorade rose, ou daurade rose, crue"
040601,26110,"Rouget0barbet de roche, vapeur"
040601,26111,"Saupe, crue"
040601,26113,"Chinchard, cru"
040601,26122,"Églefin, cru"
040601,26127,"Congre, cru"
040601,26128,"Grenadier (de roche), cru"
040601,26129,"Lieu jaune ou colin, cru"
040601,26130,"Julienne ou Lingue, crue"
040601,26133,"Tacaud, cru"
040601,26134,"Lieu noir, cru"
040601,26135,"Limande0sole, crue"
040601,26141,"Foie de morue, cru"
040601,26146,"Vivaneau, cru"
040601,26153,"Sabre, cru"
040601,26154,"Flétan du Groënland ou flétan noir ou flétan commun, cru"
040601,26157,"Carangue, cru"
040601,26159,"Coulirou, cru"
040601,26161,"Saumon, cru, sauvage"
040601,26162,"Requin, cru"
040601,26166,"Orphie commune, crue"
040601,26168,"Lompe, crue"
040601,26170,"Brème, cru"
040601,26171,"Omble chevalier, cru"
040601,26172,"Loup tacheté, cru"
040601,26173,"Sprat, cru"
040601,26174,"Turbot, cru"
040601,26175,"Corégone lavaret, cru"
040601,26178,"Mérou, cru"
040601,26194,"Lingue bleue ou Lingue, crue"
040601,26200,"Sole tropicale ou Sole langue, crue"
040601,26201,"Turbot d'élevage, cru"
040601,26205,"Bar commun ou loup (Méditerranée), cru, sauvage"
040601,26206,"Bar commun ou loup (Méditerranée), cru, élevage"
040601,26208,"Baudroie rousse ou Lotte, crue"
040601,26210,"Sébaste du nord, ou grand sébaste, ou dorade sébaste, ou daurade sébaste, crue"
040601,26213,"Hoki, tout lieu de pêche, cru"
040601,26214,"Grenadier bleu ou hoki de Nouvelle0Zélande, cru"
040601,26219,"Grondin perlon, cru"
040601,26233,"Merlu blanc du Cap, surgelé, cru"
040601,26235,"Chinchard maigre, cru"
040601,26236,"Chinchard gras, cru"
040601,26237,"Hareng maigre, cru"
040601,26238,"Hareng gras, cru"
040601,26240,"Joëls (petits poissons entiers) pour friture, crus"
040601,26241,"Empereur, filet, sans peau, cru"
040601,26244,"Rouget0barbet, filet avec peau, surgelé, cru (Thaïlande, Sénégal…)"
040601,27003,"Carpe, crue, élevage"
040601,27008,"Truite d'élevage, crue"
040601,27009,"Truite arc en ciel, crue, élevage"
040601,27010,"Perche, crue"
040601,27011,"Brochet, cru"
040601,27012,"Esturgeon, cru"
040601,27016,"Anguille, crue"
040601,27017,"Pangasius ou Poisson0chat, cru"
040601,27019,"Tilapia, cru"
040601,27021,"Truite saumonée, crue"
040601,27023,"Lotte de rivière, crue"
040601,27024,"Sandre, cru"
040601,27025,"Perche du Nil, crue"
040701,10000,"Bigorneau, cuit"
040701,10004,"Coquille Saint0Jacques, noix et corail, cuite"
040701,10006,"Crevette grise, cuite"
040701,10007,"Crevette, cuite"
040701,10009,"Homard, bouilli/cuit à l'eau"
040701,10013,"Moule, bouillie/cuite à l'eau"
040701,10020,"Bulot ou Buccin, cuit"
040701,10022,"Langouste, bouillie/cuite à l'eau"
040701,10025,"Crabe ou Tourteau, bouilli/cuit à l'eau"
040701,10027,"Clam, Praire ou Palourde, bouilli/cuit à l'eau"
040701,10031,"Écrevisse, cuite"
040701,10033,"Crevette rose bouquet, cuite"
040701,10037,"Calmar ou calamar ou encornet, bouilli/cuit à l'eau"
040701,10043,Fruits de mer (aliment moyen)
040701,10044,"Langoustine, bouillie/cuite à l'eau"
040701,10057,"Araignée de mer, cuite"
040701,10061,"Crevette pattes blanches, cuite"
040701,10062,"Crevette géante tigrée, cuite"
040701,10064,"Crevette royale rose, cuite"
040701,10079,"Poulpe, cuit"
040701,10080,"Fruits de mer, cuits, surgelés"
040701,10084,"Calmar ou calamar ou encornet, frit ou poêlé avec matière grasse"
040701,10099,"Escargot, sans matière grasse ajoutée, cuit"
040701,34501,"Grenouille, cuisse, grillée/poêlée"
040801,10001,"Calmar ou calamar ou encornet, cru"
040801,10003,"Coquille Saint0Jacques, noix et corail, crue"
040801,10008,"Escargot, cru"
040801,10010,"Homard, cru"
040801,10011,"Huître, sans précision, crue"
040801,10014,"Moule commune, crue"
040801,10015,"Langouste, crue"
040801,10016,"Seiche, crue"
040801,10017,"Clam, Praire ou Palourde, cru"
040801,10018,"Poulpe, cru"
040801,10019,"Bulot ou Buccin, cru"
040801,10021,"Crevette, crue"
040801,10024,"Langoustine, crue"
040801,10026,"Moule de Méditerranée, crue"
040801,10030,"Écrevisse, crue"
040801,10035,"Huître creuse, crue"
040801,10036,"Huître plate, crue"
040801,10038,"Crevette, surgelée, crue"
040801,10039,"Crabe, cru"
040801,10041,"Ormeau, cru"
040801,10045,"Coquille Saint0Jacques, noix, crue"
040801,10048,"Pecten d'Amérique ou Peigne du canada, noix, crue"
040801,10049,"Pétoncle ou Peigne du Pérou, noix, crue"
040801,10059,"Crevette rose, crue"
040801,34500,"Grenouille, cuisse, crue"
040901,8059,Rillettes de crabes
040901,8080,Rillettes de poissons
040901,8081,Rillettes de saumons
040901,8082,Rillettes de thons
040901,8083,Rillettes de maquereaus
040901,8291,Terrine de poisson
040901,8292,"Terrine de fruits de mer, avec ou sans poisson"
040901,8293,Tarama
040901,10002,"Calmar ou Calamar ou encornet, à la romaine (beignet)"
040901,10005,"Crabe, miettes et ou pattes décortiquées, appertisé, égoutté"
040901,10012,"Langoustine, panée, frite"
040901,10023,Beignet de crevette
040901,10028,"Moule, appertisée, égouttée"
040901,10042,"Escargot en sauce au beurre persillé, cuit"
040901,10081,"Moules à la sauce catalane ou escabèche (tomate), appertisée, égouttée"
040901,25433,Accra de poisson
040901,25537,Carpaccio de saumon avec marinade
040901,25995,"Maquereau, filet grillé, appertisé, nature, égoutté"
040901,25999,"Anchois, filets roulés aux câpres, semi0conserve, égoutté"
040901,26000,"Anchois, filets à l'huile, semi0conserve, égoutté"
040901,26002,"Carrelet ou plie, pané, frit"
040901,26004,"Oeufs de lompe, semi0conserve"
040901,26005,"Caviar, semi0conserve"
040901,26010,Hareng mariné ou rollmops
040901,26016,"Limande0sole, panée, frite"
040901,26027,"Pilchard, sauce tomate, appertisé, égoutté"
040901,26028,"Poisson, croquette ou beignet ou nuggets, frit"
040901,26029,"Poisson pané, surgelé, cru"
040901,26030,"Poisson pané, frit"
040901,26034,"Sardine, à l'huile, appertisée, égouttée"
040901,26035,"Sardine, sauce tomate, appertisée, égouttée"
040901,26039,"Thon, au naturel, appertisé, égoutté"
040901,26040,"Sardine, à l'huile d'olive, appertisée, égouttée"
040901,26046,"Surimi, bâtonnets, tranche ou râpé saveur crabe"
040901,26056,"Oeufs de cabillaud, fumés, semi0conserve"
040901,26077,"Thon germon ou thon blanc, cuit à la vapeur sous pression"
040901,26086,"Maquereau, filet sauce tomate, appertisé, égoutté"
040901,26096,"Maquereau, filet sauce moutarde, appertisé, égoutté"
040901,26097,"Maquereau, filet au vin blanc, appertisé, égoutté"
040901,26119,"Saumon, appertisé, égoutté"
040901,26123,"Maquereau, au naturel, appertisé, égoutté"
040901,26124,"Merlan, pané"
040901,26142,"Foie de morue, appertisé, égoutté"
040901,26151,"Oeufs de truite, semi0conserve"
040901,26177,"Anchois au sel (anchoité, semi0conserve)"
040901,26179,"Thon germon ou thon blanc, à l'huile d'olive, appertisé, égoutté"
040901,26180,"Thon à l'huile de tournesol, entier, appertisé, égoutté"
040901,26181,"Thon albacore ou thon jaune, au naturel, appertisé, égoutté"
040901,26186,"Maquereau, mariné"
040901,26187,"Anchois commun, mariné"
040901,26231,"Sardine, filets sans arêtes à l'huile d'olive, appertisés, égouttés"
040901,26239,"Surimi, fourré au fromage"
040901,26242,"Thon à la tomate, miettes, appertisées, égouttées"
040901,26243,"Thon, à la catalane ou à l'escabèche (sauce tomate), appertisé"
040901,26245,"Thon à l'huile de tournesol, miettes, appertisées, égouttées"
040901,26275,"Oeufs de saumon, semi0conserve"
041001,22008,"Oeuf, blanc (blanc d'oeuf), cuit"
041001,22009,"Oeuf, jaune (jaune d'oeuf), cuit"
041001,22010,"Oeuf, dur"
041001,22011,"Oeuf, poché"
041001,22014,"Oeuf, à la coque"
041001,22501,"Oeuf, au plat, frit, salé"
041001,22502,"Oeuf, brouillé, avec matière grasse"
041001,22505,"Oeuf, au plat, sans matière grasse"
041002,22000,"Oeuf, cru"
041002,22001,"Oeuf, blanc (blanc d'oeuf), cru"
041002,22002,"Oeuf, jaune (jaune d'oeuf), cru"
041002,22050,"Oeuf de caille, cru"
041002,22060,"Oeuf de cane, cru"
041002,22070,"Oeuf d'oie, cru"
041002,22080,"Oeuf de dinde, cru"
041003,22003,"Oeuf, jaune (jaune d'oeuf), en poudre"
041003,22004,"Oeuf, blanc (blanc d'oeuf), en poudre"
041003,22013,"Oeuf, en poudre"
041003,22506,Omelette au fromage
041003,22507,Omelette aux lardons
041003,22508,Omelette aux champignons
041003,22509,Omelette aux fines herbes
041003,22510,Tortilla espagnole aux oignons (omelette aux pommes de terre et oignons)
041003,22511,"Omelette, garnitures diverses : légumes, fromages, viandes... (aliment moyen)"
041101,20591,"Protéine de soja texturée, réhydratée"
041101,20904,Tofu nature
041101,20912,Tofu fumé
041101,25223,Bouchées ou émincé végétal au soja et blé (convient aux véganes ou végétaliens)
041101,25224,Bouchées ou émincé au soja et blé  (ne convient pas aux véganes ou végétaliens)
041101,25598,Seitan
050101,19023,"Lait entier, UHT"
050101,19024,"Lait entier, pasteurisé"
050101,19037,"Lait demi0écrémé, UHT, enrichi en vitamine D seulement"
050101,19038,"Lait à 1,2% de matière grasse, UHT, enrichi en plusieurs vitamines"
050101,19039,"Lait, teneur en matière grasse inconnue, UHT (aliment moyen)"
050101,19041,"Lait demi0écrémé, UHT"
050101,19042,"Lait demi0écrémé, pasteurisé"
050101,19050,"Lait écrémé, UHT"
050101,19051,"Lait écrémé, pasteurisé"
050101,19060,Lait demi0écrémé (ou à teneur en matière grasse légèrement inférieure) à teneur réduite en lactose
050102,19200,"Lait de chèvre, entier, UHT"
050102,19201,"Lait de chèvre, demi0écrémé, UHT"
050102,19202,"Lait de chèvre, entier, cru"
050102,19225,"Lait de jument, entier"
050102,19250,"Lait de brebis, entier"
050103,19021,"Lait en poudre, entier"
050103,19026,"Lait concentré non sucré, entier"
050103,19027,"Lait concentré sucré, entier"
050103,19044,"Lait en poudre, demi0écrémé"
050103,19054,"Lait en poudre, écrémé"
050201,19500,"Boisson lactée, lait fermenté ou yaourt à boire, aromatisé, avec édulcorants, allégé en sucres"
050201,19508,"Boisson lactée, lait fermenté ou yaourt à boire, aromatisé, sucré"
050201,19516,"Boisson lactée, lait fermenté ou yaourt à boire, aromatisé, sucré, au L Casei"
050201,19534,"Boisson lactée, lait fermenté ou yaourt à boire, aromatisé, sucré, enrichi en vitamine D"
050201,19535,"Boisson lactée, lait fermenté ou yaourt à boire, aux fruits, sucré"
050201,19536,"Boisson lactée, lait fermenté ou yaourt à boire, aux fruits, sucré, enrichie en vitamine D"
050201,19538,"Boisson lactée, lait fermenté ou yaourt à boire, nature, sucré, au L Casei"
050201,19539,"Lait fermenté ou spécialité laitière type yaourt, aromatisé, sucré, au bifidus"
050201,19541,"Lait fermenté ou spécialité laitière type yaourt, aux fruits, avec édulcorants, 0% MG, au bifidus"
050201,19542,"Lait fermenté ou spécialité laitière type yaourt, aux fruits, sucré, au bifidus"
050201,19543,"Lait fermenté ou spécialité laitière type yaourt, aux fruits avec édulcorants, aux esters de stérol"
050201,19544,"Lait fermenté ou spécialité laitière type yaourt, nature, 0% MG, au bifidus"
050201,19546,"Lait fermenté ou spécialité laitière type yaourt, nature, au bifidus"
050201,19548,"Lait fermenté ou spécialité laitière type yaourt, sur lit de fruits, sucré, au bifidus"
050201,19550,"Yaourt à la grecque, au lait de brebis"
050201,19552,"Yaourt à la grecque, sur lit de fruits"
050201,19553,"Yaourt au lait de brebis, aromatisé, sucré"
050201,19554,"Yaourt au lait de brebis, nature, 3% MG environ"
050201,19556,"Yaourt au lait de chèvre, nature, 5% MG environ"
050201,19557,"Yaourt, lait fermenté ou spécialité laitière sur lit de fruits, sucré"
050201,19558,"Yaourt, lait fermenté ou spécialité laitière, aux céréales, 0% MG"
050201,19559,"Yaourt, lait fermenté ou spécialité laitière, aromatisé, avec édulcorants, 0% MG"
050201,19575,"Yaourt, lait fermenté ou spécialité laitière, aromatisé, sucré"
050201,19577,"Yaourt, lait fermenté ou spécialité laitière, aromatisé, sucré, à la crème"
050201,19578,"Yaourt, lait fermenté ou spécialité laitière, aromatisé, sucré, enrichi en vitamine D"
050201,19579,"Yaourt, lait fermenté ou spécialité laitière, aux céréales"
050201,19580,"Yaourt, lait fermenté ou spécialité laitière, aux copeaux de chocolat, à la crème, sucré"
050201,19581,"Yaourt, lait fermenté ou spécialité laitière, aux fruits, avec édulcorants, 0% MG"
050201,19582,"Yaourt, lait fermenté ou spécialité laitière, aux fruits, avec édulcorants enrichi en vitamine D"
050201,19587,"Yaourt, lait fermenté ou spécialité laitière, aux fruits, sucré"
050201,19589,"Yaourt, lait fermenté ou spécialité laitière, aux fruits, sucré, à la crème"
050201,19592,"Yaourt, lait fermenté ou spécialité laitière, aux fruits, sucré, enrichi en vitamine D"
050201,19593,"Yaourt, lait fermenté ou spécialité laitière, nature"
050201,19594,"Yaourt, lait fermenté ou spécialité laitière, nature, 0% MG"
050201,19596,"Yaourt, lait fermenté ou spécialité laitière, nature, 0% MG, enrichi en vitamine D"
050201,19597,"Yaourt, lait fermenté ou spécialité laitière, nature, 0% MG, sucré, enrichi en vitamine D"
050201,19598,"Yaourt, lait fermenté ou spécialité laitière, nature, à la crème"
050201,19599,"Yaourt, lait fermenté ou spécialité laitière, nature, sucré"
050201,19600,Yaourt ou spécialité laitière nature (aliment moyen)
050201,19624,Yaourt ou spécialité laitière nature ou aux fruits (aliment moyen)
050201,19628,Yaourt ou spécialité laitière aux fruits (aliment moyen)
050201,19669,"Spécialité laitière type encas, riche en protéines, sur lit de fruits, sucrée"
050201,19671,"Yaourt, lait fermenté ou spécialité laitière, aromatisé ou aux fruits, 0% MG (aliment moyen)"
050201,19672,"Yaourt, lait fermenté ou spécialité laitière, aromatisé ou aux fruits, (aliment moyen)"
050201,19675,"Yaourt, lait fermenté ou spécialité laitière, aromatisé ou aux fruits (aliment moyen)"
050201,19676,"Yaourt, lait fermenté ou spécialité laitière, aromatisé ou aux fruits, sucré (aliment moyen)"
050201,19677,"Yaourt, lait fermenté ou spécialité laitière, aromatisé ou aux fruits, sucré (aliment moyen)"
050201,19682,"Yaourt, lait fermenté ou spécialité laitière, aromatisé ou aux fruits (aliment moyen)"
050201,19801,"Lait fermenté à boire, nature, maigre"
050201,19805,"Lait fermenté à boire, nature, au lait entier"
050201,19860,"Yaourt à la grecque, nature"
050201,19862,"Yaourt à la grecque, aromatisé, sucré"
050201,19865,Kéfir de lait
050201,19882,"Yaourt au lait de brebis, nature, 6% MG environ"
050202,19501,Fromage blanc nature ou aux fruits (aliment moyen)
050202,19572,"Fromage frais type petit suisse, aromatisé chocolat, sucré"
050202,19638,Faisselle au coulis de fruits
050202,19639,"Faisselle, 0% MG"
050202,19641,"Faisselle, 6% MG environ"
050202,19643,"Fromage blanc et crème fouettée sur lit de fruits, sucré"
050202,19644,"Fromage blanc nature, 0% MG"
050202,19645,"Fromage blanc nature, 0% MG, enrichi en vitamine D"
050202,19646,"Fromage blanc nature, 3% MG environ"
050202,19647,"Fromage blanc nature, 3% MG environ, au bifidus"
050202,19648,"Fromage blanc nature, 3% MG environ, enrichi en vitamine D"
050202,19649,"Fromage blanc nature, gourmand, 8% MG environ"
050202,19650,"Fromage blanc ou spécialité laitière nature et crème fouetté, 10% MG environ"
050202,19651,"Fromage blanc ou spécialité laitière, aromatisé, sucré, 0% MG"
050202,19652,"Fromage blanc ou spécialité laitière, aromatisé, sucré, 3% MG environ"
050202,19653,"Fromage blanc ou spécialité laitière, aromatisé, sucré, 3% MG environ, au bifidus"
050202,19654,"Fromage blanc ou spécialité laitière, aux copeaux de chocolat, sucré, 7% MG environ"
050202,19655,"Fromage blanc ou spécialité laitière, aux fruits, avec édulcorants, allégé en sucres, 0% MG"
050202,19656,"Fromage blanc ou spécialité laitière, aux fruits, sucré, 0% MG"
050202,19657,"Fromage blanc ou spécialité laitière, aux fruits, sucré, 3% MG environ"
050202,19658,"Fromage blanc ou spécialité laitière, aux fruits, sucré, 3% MG environ, au bifidus"
050202,19659,"Fromage blanc ou spécialité laitière, aux fruits, sucré, gourmand, 7% MG environ"
050202,19661,"Fromage frais type petit suisse, aux fruits, 203% MG"
050202,19662,"Fromage frais type petit suisse, aux fruits, 203% MG, enrichi en calcium et vitamine D"
050202,19663,"Fromage frais type petit suisse, nature, 0% MG"
050202,19664,"Fromage frais type petit suisse, nature, 4% MG environ"
050202,19665,"Mousse de fromage blanc sur lit de fruits,, enrichie en calcium et vitamine D"
050202,19666,"Fromage frais type petit suisse, nature, 10% MG environ"
050202,19667,"Fromage frais type petit suisse, aromatisé ou aux fruits, 203% MG, enrichi en calcium et vitamine D"
050202,19668,"Fromage blanc ou spécialité laitière, aux fruits, avec édulcorants, allégé en sucres, 3% MG environ"
050203,19673,"Crème dessert, allégée en MG, rayon frais"
050203,19674,"Flan aux oeufs, rayon frais"
050203,19678,"Lait emprésuré aromatisé, rayon frais"
050203,19679,"Lait gélifié aromatisé, nappé caramel, rayon frais"
050203,19680,"Lait gélifié aromatisé, rayon frais"
050203,19681,"Liégeois ou viennois (chocolat, café, caramel ou vanille), rayon frais"
050203,19683,"Lait gélifié aromatisé, allégé en matière grasse et en sucre, rayon frais"
050203,19685,"Panna cotta, avec préparations de fruits ou caramel, rayon frais"
050203,23534,"Gâteau de semoule aux raisins et caramel, rayon frais"
050203,23536,"Gâteau de riz au caramel, rayon frais"
050203,39001,"Milk0shake, provenant de fast food"
050203,39200,"Crème dessert au chocolat, rayon frais"
050203,39206,"Mousse au chocolat (base laitière), rayon frais"
050203,39209,"Crème caramel, rayon frais"
050203,39211,"Crème aux oeufs (petit pot de crème chocolat, vanille, etc.), rayon frais"
050203,39212,"Riz au lait, rayon frais"
050203,39213,"Crème brûlée, rayon frais"
050203,39214,"Crème dessert à la vanille, appertisée"
050203,39215,"Ile flottante, rayon frais"
050203,39218,"Semoule au lait, rayon frais"
050203,39228,"Mousse aux fruits, rayon frais"
050203,39229,"Crème dessert à la vanille, rayon frais"
050203,39230,"Crème dessert, rayon frais (aliment moyen)"
050203,39235,"Mousse liégeoise (chocolat, café, caramel ou vanille), rayon frais"
050203,39246,"Crème dessert au café, rayon frais"
050203,39247,"Crème dessert au caramel, rayon frais"
050203,39505,"Crème dessert, appertisée (aliment moyen)"
050203,39506,"Crème dessert au chocolat, appertisée"
050203,39511,"Crème dessert, rayon frais ou appertisée (aliment moyen)"
050204,19689,Cheesecake ou Gâteau au fromage frais
050204,19698,Tiramisu
050204,19852,Mousse à la crème de marrons
050204,23474,Profiteroles (crème pâtissière et sauce chocolat)s
050204,23535,"Gâteau de semoule, appertisé"
050204,39210,Mousse au chocolat traditionnelle
050204,39216,Clafoutis aux fruits
050204,39220,Liégeois aux fruits
050204,39232,"Gâteau de riz, appertisé"
050204,39233,Fondant au chocolat noir et crème anglaise
050204,39234,"Gâteau au chocolat, coeur fondant (rayon frais)"
050204,39236,Pain perdu
050204,39400,"Lait de poule, sans alcool"
050204,39710,Crème pâtissière
050205,19692,"Dessert au soja, aux fruits, sucré, enrichi en calcium, fermenté"
050205,19693,"Dessert au soja, nature, non sucré, non enrichi, fermenté"
050205,19694,"Dessert au soja, nature, non sucré, enrichi en calcium, fermenté"
050205,19695,"Dessert au soja, aux fruits, sucré, non enrichi, fermenté"
050205,19696,"Dessert au soja, aux amandes, fermenté"
050205,20911,"Dessert au soja, aromatisé, sucré, enrichi en calcium"
050205,20921,"Dessert au soja, aromatisé, sucré, non enrichi"
050205,20922,"Dessert végétal sans soja (amande, avoine, chanvre, coco, riz), aromatisé, sucré, non enrichi"
050205,20923,"Dessert végétal sans soja (coco, riz), aux fruits, sucré, enrichi en calcium, fermenté"
050205,39248,Mousse au chocolat végétale
050301,12999,Fromage (aliment moyen)
050301,12001,"Camembert, sans précision"
050301,12003,Fromage à pâte molle et croûte fleurie (type camembert)
050301,12006,Camembert au lait cru
050301,12008,Fromage à pâte molle et croûte fleurie double crème environ 30% MG
050301,12009,Fromage rond à pâte molle et croûte fleurie 5 à 11% MG type camembert allégé en matière grasse
050301,12010,Coulommiers
