050301,12012,Fromage rond à pâte molle et croûte fleurie environ 11% MG type coulommiers allégé en matière grasse
050301,12013,Fromage rond à pâte molle et croûte fleurie environ 5% MG type camembert allégé en matière grasse
050301,12020,"Brie, sans précision"
050301,12021,Brie de Meaux
050301,12022,Brie de Melun
050301,12025,Carré de l'Est
050301,12028,Chaource
050301,12029,Maroilles laitier
050301,12030,Maroilles fermier
050301,12031,Neufchâtel
050301,12033,Fromage à pâte molle triple crème environ 40% MG
050301,12034,Fromage à pâte molle et croûte lavée (aliment moyen)
050301,12035,"Fromage à pâte molle et croûte lavée, allégé environ 13% MG"
050301,12036,"Maroilles, sans précision"
050301,12037,Livarot
050301,12038,Époisses
050301,12039,Munster
050301,12040,Langres
050301,12042,Pont l'Évêque
050301,12045,Reblochon
050301,12047,"Fromage à pâte molle à croûte lavée, au lait pasteurisé (type Vieux Pané)"
050301,12049,Saint0Marcellin
050301,12050,Fromage à pâte molle et croûte mixte (lavée et fleurie) colorée
050301,12051,Mont d'or ou Vacherin du Haut0Doubs (produit en France) ou Vacherin0Mont d'Or (produit en Suisse)
050301,12052,Saint0Félicien
050301,12064,Boulette d'Avesne
050301,12801,"Fromage de chèvre lactique affiné, au lait cru "
050301,12802,"Fromage de chèvre lactique affiné, au lait pasteurisé (type bûchette ou crottin)"
050301,12803,"Fromage de chèvre lactique affiné (type bûchette, crottin, Sainte0Maure)"
050301,12807,Sainte0Maure de Touraine (fromage de chèvre)
050301,12810,Fromage de chèvre demi0sec
050301,12812,Fromage de chèvre bûche
050301,12813,"Fromage de chèvre bûche, allégé en matière grasse"
050301,12814,"Fromage de chèvre à pâte molle non pressée non cuite croûte naturelle, au lait pasteurisé"
050301,12815,Fromage de chèvre sec
050301,12820,Fromage de chèvre à pâte molle et croûte fleurie type camembert
050301,12824,Fromage de brebis à pâte molle et croûte fleurie
050301,12830,Chabichou (fromage de chèvre)
050301,12831,Pélardon (fromage de chèvre)
050301,12832,"Crottin de chèvre, au lait cru"
050301,12833,"Crottin de chèvre, sans précision"
050301,12834,Crottin de Chavignol (fromage de chèvre)
050301,12836,Picodon (fromage de chèvre)
050301,12839,Pouligny Saint0Pierre (fromage de chèvre)
050301,12842,Sainte0Maure (fromage de chèvre)
050301,12845,Selles0sur0Cher (fromage de chèvre)
050301,12846,Chevrot (fromage de chèvre)
050301,12847,Rocamadour (fromage de chèvre)
050301,12848,Valençay (fromage de chèvre)
050302,12500,Roquefort
050302,12519,Fourme de Montbrison
050302,12520,Fromage bleu au lait de vache
050302,12521,Fromage bleu d'Auvergne
050302,12522,Fourme d'Ambert
050302,12523,Fromage bleu des Causses
050302,12524,Gorgonzola
050302,12526,Bleu de Gex ou Fromage bleu du Haut0jura ou Bleu de septmoncel (AOC)
050302,12527,Fromage bleu de Bresse
050302,12528,Fromage bleu de Bresse allegé environ 15% MG
050303,12100,Fromage à pâte pressée cuite (aliment moyen)
050303,12105,Beaufort
050303,12110,Comté
050303,12112,Abondance
050303,12113,Gruyère IGP France
050303,12114,Gruyère
050303,12115,Emmental ou emmenthal
050303,12116,"Fromage à pate pressée cuite type emmental ou emmenthal, allégé en matière grasse"
050303,12118,Emmental ou emmenthal râpé
050303,12119,Ossau0Iraty
050303,12120,Parmesan
050303,12121,Fontina
050303,12122,Pecorino
050303,12123,Grana Padano
050303,12705,Fromage à pâte ferme environ 14% MG type Masdaam à teneur réduite en MG
050303,12716,Provolone
050303,12720,"Fromage à pâte ferme, enrobé de cire"
050303,12722,Cantal entre0deux
050303,12723,"Cantal, Salers ou Laguiole"
050303,12725,Salers
050303,12726,Cheddar
050303,12729,Edam
050303,12735,Mimolette jeune
050303,12736,Gouda
050303,12737,Mimolette demi0vieille
050303,12738,Mimolette vieille
050303,12740,"Mimolette, sans précision"
050303,12741,Fromage à pâte ferme environ 27% MG type Maasdam
050303,12742,Mimolette extra0vieille
050303,12743,Morbier
050303,12747,Fromage de brebis des Pyrénées
050303,12748,"Saint0Nectaire, laitier"
050303,12749,Raclette (fromage)
050303,12751,"Saint0Nectaire, fermier"
050303,12752,"Saint0Nectaire, sans précision"
050303,12755,Saint0Paulin (fromage à pâte pressée non cuite demi0ferme)
050303,12758,Tomme ou tome de vache
050303,12759,Tomme ou tome de montagne ou de Savoie
050303,12760,"Tomme ou tome, allégée en matière grasse, environ 13% MG"
050303,12761,Asiago
050303,12762,Fromage de brebis Corse à pâte molle
050303,12763,Tome des Bauges
050303,12827,Fromage de brebis à pâte pressée
050303,12828,Fromage de lactosérum de brebis
050304,12300,Fromage fondu en tranchettes
050304,12305,Fromage fondu en portions ou en cubes environ 8% MG
050304,12310,Fromage fondu en portions ou en cubes environ 20% MG
050304,12320,"Fromage fondu double crème, environ 31% MG"
050304,12325,Cancoillotte (spécialité fromagère fondue)
050304,12355,Spécialité fromagère fondante au fromage blanc et aux noix
050304,12356,Snack pour enfants à base de fromage fondu et de gressins
050305,12060,"Fromage type feta, au lait de vache"
050305,12061,Fromage 100% brebis (Feta AOP ou type Feta)
050305,12063,"Fromage type feta, au lait de vache, à l'huile et aux aromates"
050305,12066,Feta AOP
050305,12315,Spécialité fromagère non affinée environ 25% MG
050305,12340,Spécialité fromagère non affinée environ 20% MG
050305,12800,"Fromage de chèvre frais, au lait pasteurisé (type bûchette fraîche)"
050305,12804,"Fromage de chèvre frais, au lait cru (type palet ou crottin frais)"
050305,12805,"Fromage de chèvre frais, au lait pasteurisé ou cru (type crottin frais ou bûchette fraîche)"
050305,12819,"Fromage de chèvre à tartiner, nature"
050305,19530,Spécialité fromagère non affinée à tartiner environ 30040 % MG aromatisée (ex: ail et fines herbes)
050305,19584,Mascarpone
050305,19585,Ricotta
050305,19590,Mozzarella au lait de vache
050305,19591,"Mozzarella au lait de bufflonne ou buflesse (""di bufala"")"
050306,1027,"Spécialité végétale type fromage à tartiner, au soja"
050306,1028,"Spécialité végétale type fromage, à la noix de cajou"
050306,1029,"Spécialité végétale type fromage en tranche ou râpé, sans soja"
050401,19402,Crème de lait ou spécialité à base de crème légère (aliment moyen)
050401,19410,"Crème de lait, 30% MG, épaisse, rayon frais"
050401,19411,"Crème d'Isigny AOP, >= 35% MG"
050401,19415,"Crème de lait, 30% MG, semi0épaisse, UHT"
050401,19420,"Crème chantilly, sous pression, UHT"
050401,19430,"Crème de lait, 15 à 20% MG, légère, semi0épaisse, UHT"
050401,19431,"Crème de lait, 15 à 20% MG, légère, épaisse, rayon frais"
050401,19433,"Spécialité à base de crème légère 8% MG, fluide ou épaisse"
050401,19436,"Crème de lait, 15 à 20% MG, légère, fluide, rayon frais"
060101,18008,"Eau de source, embouteillée (aliment moyen)"
060101,18009,"Eau minérale, embouteillée, faiblement minéralisée (aliment moyen)"
060101,18044,Eau minérale (aliment moyen)
060101,18045,"Eau minérale, plate (aliment moyen)"
060101,18046,"Eau minérale, gazeuse (aliment moyen)"
060101,18066,Eau du robinet
060101,18430,Eau embouteillée de source
060101,76000,"Eau minérale Abatilles, embouteillée, non gazeuse, faiblement minéralisée (Arcachon, 33)"
060101,76001,"Eau minérale Aix0les0Bains, embouteillée, non gazeuse, faiblement minéralisée (Aix0les0Bains, 73)"
060101,76002,"Eau minérale Aizac, embouteillée, gazeuse, faiblement minéralisée (Aizac, 07)"
060101,76004,"Eau minérale Amanda, embouteillée, non gazeuse, fortement minéralisée (St0Amand, 59)"
060101,76006,"Eau minérale Arcens, embouteillée, gazeuse, moyennement minéralisée (Arcens, 07)"
060101,76007,"Eau minérale Ardesy, embouteillée, gazeuse, fortement minéralisée (Ardes, 63)"
060101,76010,"Eau minérale Celtic, embouteillée, gazeuse ou non gazeuse, très faiblement minéralisée"
060101,76011,"Eau minérale Chambon, embouteillée, non gazeuse, faiblement minéralisée (Chambon, 45)"
060101,76012,"Eau minérale Chantemerle, embouteillée, non gazeuse, faiblement minéralisée (Le Pestrin, 07)"
060101,76013,"Eau minérale Chateauneuf, embouteillée, gazeuse, fortement minéralisée (Chateauneuf, 63)"
060101,76014,"Eau minérale Chateldon, embouteillée, gazeuse, fortement minéralisée (Chateldon, 63)"
060101,76015,"Eau minérale Clos de l'Abbaye, embouteillée, non gazeuse, moyennement minéralisée (St0Amand, 59)"
060101,76016,"Eau minérale Contrex, embouteillée, non gazeuse, fortement minéralisée (Contrexéville, 88)"
060101,76017,"Eau minérale Dax, embouteillée, non gazeuse, moyennement minéralisée (Dax, 40)"
060101,76018,"Eau minérale Didier, embouteillée, gazeuse, fortement minéralisée (Martinique)"
060101,76019,"Eau minérale Didier, embouteillée non gazeuse, fortement minéralisée (Martinique)"
060101,76020,"Eau minérale Evian, embouteillée, non gazeuse, faiblement minéralisée (Evian, 74)"
060101,76022,"Eau minérale Hépar, embouteillée, non gazeuse, fortement minéralisée (Vittel, 88)"
060101,76023,"Eau minérale Hydroxydase, embouteillée, gazeuse, fortement minéralisée (Le Breuil sur Couze, 63)"
060101,76024,"Eau minérale Vernière, embouteillée, gazeuse, moyennement minéralisée (Les Aires, 34)"
060101,76025,"Eau minérale Luchon, embouteillée, non gazeuse, faiblement minéralisée (Luchon, 31)"
060101,76027,"Eau minérale Mont0Roucous, embouteillée, très faiblement minéralisée (Lacaune, 81)"
060101,76028,"Eau de source Ogeu, embouteillée, faiblement minéralisée (Ogeu, 64)"
060101,76029,"Eau minérale Orée du bois, embouteillée, non gazeuse, moyennement minéralisée (St0Amand, 59)"
060101,76030,"Eau minérale Orezza, embouteillée, gazeuse, moyennement minéralisée (Rapaggio, 20B)"
060101,76031,"Eau minérale Parot, embouteillée, gazeuse, moyennement minéralisée (St0Romain0le0Puy, 42)"
060101,76032,"Eau minérale Plancoet, embouteillée, gazeuse ou non gazeuse, faiblement minéralisée (Plancoet, 22)"
060101,76033,"Eau minérale Propiac, embouteillée, non gazeuse, fortement minéralisée (Propiac, 26)"
060101,76034,"Eau minérale Puits St0Georges, embouteillée, gazeuse, moyennement minéralisée (St0Romain0le0Puy, 42)"
060101,76035,"Eau minérale Quézac, embouteillée, gazeuse, moyennement minéralisée (Quézac, 48)"
060101,76036,"Eau minérale Reine des basaltes, embouteillée, gazeuse, moyennement minéralisée (Asperjoc, 07)"
060101,76037,"Eau minérale Rozana, embouteillée, gazeuse, fortement minéralisée (Beauregard, 63)"
060101,76038,"Eau minérale Sail0les0Bains, embouteillée, non gazeuse, faiblement minéralisée (Sail0les0Bains, 42)"
060101,76039,"Eau minérale Salvetat, embouteillée, gazeuse, moyennement minéralisée (La Salvetat, 34)"
060101,76043,"Eau minérale St0Amand, embouteillée, gazeuse ou non gazeuse, moyennement minéralisée (St0Amand, 59)"
060101,76044,"Eau minérale St0Antonin, embouteillée, non gazeuse, fortement minéralisée (St0Antonin0Noble0Val, 82)"
060101,76046,"Eau minérale St0Diéry, embouteillée, gazeuse, fortement minéralisée (St0Diéry, 63)"
060101,76047,"Eau minérale Ste0Marguerite, embouteillée, gazeuse, moyennement minéralisée (St0Maurice, 63)"
060101,76049,"Eau minérale St0Yorre, embouteillée, gazeuse, fortement minéralisée (Saint0Yorre, 03)"
060101,76050,"Eau minérale Thonon, embouteillée, non gazeuse, faiblement minéralisée (Thonon, 74)"
060101,76053,"Eau minérale Ventadour, embouteillée, gazeuse, faiblement minéralisée (Le Pestrin, 07)"
060101,76054,"Eau minérale Vernet, embouteillée, gazeuse, faiblement minéralisée (Prades, 07)"
060101,76055,"Eau minérale Vichy Célestins, embouteillée, gazeuse, fortement minéralisée (Saint0Yorre, 03)"
060101,76056,"Eau minérale Vittel, embouteillée, non gazeuse, moyennement minéralisée (Vittel, 88)"
060101,76057,"Eau minérale Volvic, embouteillée, non gazeuse, faiblement minéralisée (Volvic, 63)"
060101,76058,"Eau minérale Volvic active, embouteillée, gazeuse, faiblement minéralisée (Volvic, 63)"
060101,76059,"Eau minérale Wattwiller, embouteillée, gazeuse ou non gazeuse, faiblement minéraliséee"
060101,76060,"Eau minérale Perrier, embouteillée, gazeuse, faiblement minéralisée (Vergèse, 30)"
060101,76061,"Eau minérale Badoit, embouteillée, gazeuse, moyennement minéralisée (St0Galmier, 42)"
060101,76062,"Eau minérale Avra, embouteillée, non gazeuse, faiblement minéralisée (Grèce)"
060101,76063,"Eau minérale Beckerich, embouteillée, non gazeuse, faiblement minéralisée (Luxembourg)"
060101,76065,"Eau minérale Chaudfontaine, embouteillée, non gazeuse, faiblement minéralisée (Belgique)"
060101,76066,"Eau minérale Christinen Brunnen, embouteillée, non gazeuse, moyennement minéralisée (Allemagne)"
060101,76067,"Eau minérale Courmayeur, embouteillée, non gazeuse, fortement minéralisée (Italie)"
060101,76069,"Eau minérale Levissima, embouteillée, non gazeuse, faiblement minéralisée (Italie)"
060101,76070,"Eau minérale Luso, embouteillée, non gazeuse, très faiblement minéralisée (Portugal)"
060101,76071,"Eau minérale Néro, embouteillée, non gazeuse, faiblement minéralisée (Grèce)"
060101,76072,"Eau minérale Penacova, embouteillée, non gazeuse, très faiblement minéralisée (Portugal)"
060101,76074,"Eau minérale San Bernardo, embouteillée, très faiblement minéralisée (Italie)"
060101,76075,"Eau minérale San Pellegrino, embouteillée, gazeuse, moyennement minéralisée (Italie)"
060101,76076,"Eau minérale Spa0Reine, embouteillée, gazeuse ou non non gazeuse, moyennement minéralisée (Belgique)"
060101,76078,"Eau minérale Valvert, embouteillée, non gazeuse, faiblement minéralisée (Belgique)"
060101,76079,"Eau minérale Appollinaris, embouteillée, non gazeuse, fortement minéralisée (Allemagne)"
060101,76080,"Eau de source Cristaline, embouteillée, non gazeuse"
060101,76081,"Eau minérale Biovive, embouteillée, non gazeuse, faiblement minéralisée (Dax, 40)"
060101,76082,"Eau minérale La Cairolle, embouteillée, non gazeuse, fortement minéralisée (Les Aires, 34)"
060101,76083,"Eau minérale Cilaos, embouteillée, gazeuse, fortement minéralisée (Cilaos, 974)"
060101,76085,"Eau minérale La Française, embouteillée, non gazeuse, fortement minéralisée (Propiac, 26)"
060101,76086,"Eau minérale Montcalm, embouteillée, non gazeuse, très faiblement minéralisée (Auzat, 09)"
060101,76087,"Eau minérale Montclar, embouteillée, non gazeuse, faiblement minéralisée (Montclar, 04)"
060101,76088,"Eau minérale Nessel, embouteillée, gazeuse, moyennement minéralisée (Soultzmatt, 68)"
060101,76089,"Eau minérale Ogeu, embouteillée, gazeuse, faiblement minéralisée (Ogeu0les0Bains, 64)"
060101,76090,"Eau minérale Ogeu, embouteillée, non gazeuse, faiblement minéralisée (Ogeu0les0Bains, 64)"
060101,76091,"Eau minérale Prince Noir, embouteillée, non gazeuse, fortement minéralisée"
060101,76092,"Eau minérale St0Alban, embouteillée, gazeuse, moyennement minéralisée (St0Alban, 42)"
060101,76093,"Eau minérale St0Géron, embouteillée, gazeuse, moyennement minéralisée (St0Géron, 43)"
060101,76094,"Eau minérale St0Michel0de0Mourcairol, embouteillée, gazeuse, moyennement minéralisée (Les Aires, 34)"
060101,76095,"Eau minérale Treignac, embouteillée, non gazeuse, très faiblement minéralisée (Treignac, 19)"
060101,76096,"Eau minérale Vals, embouteillée, gazeuse, moyennement minéralisée (Vals0les0Bains, 07)"
060101,76097,"Eau minérale Vauban, embouteillée, non gazeuse, moyennement minéralisée (St0Amand0les0Eaux, 59)"
060101,76100,"Eau minérale Carola, embouteillée, gazeuse ou non gazeuse, moyennement minéralisée (Ribeauville, 68)"
060101,76101,"Eau minérale Mont0Blanc, embouteillée, non gazeuse, faiblement minéralisée (Italie)"
060101,76102,"Eau minérale Eden (La Goa), embouteillée, non gazeuse, faiblement minéralisée (Suisse)"
060201,2000,"Jus d'ananas, à base de concentré"
060201,2002,"Jus multifruit, pur jus, multivitaminé"
060201,2004,Jus de fruits (aliment moyen)
060201,2006,"Jus de carotte, pur jus"
060201,2007,"Jus de citron, maison"
060201,2011,"Jus multifruit 0 base orange, multivitaminé"
060201,2012,"Jus d'orange, à base de concentré"
060201,2013,"Jus d'orange, maison"
060201,2014,"Jus de pomme, à base de concentré"
060201,2015,"Jus de pamplemousse (pomélo), à base de concentré"
060201,2016,"Jus de raisin, pur jus"
060201,2017,"Jus de grenade, pur jus"
060201,2018,Jus de pruneau
060201,2019,"Jus de raisin, à base de concentré"
060201,2023,"Jus de mangue, frais"
060201,2024,"Jus de fruit de la passion ou maracudja, frais"
060201,2025,"Jus de pamplemousse (pomélo), maison"
060201,2026,"Jus de tomate, pur jus, salé à 3 g/L"
060201,2027,"Jus de pamplemousse (pomelo), pur jus"
060201,2028,"Jus de citron, pur jus"
060201,2030,"Jus de citron vert, maison"
060201,2031,"Jus de citron vert, pur jus"
060201,2032,"Jus de tomate, pur jus, salé à 6g/L"
060201,2033,"Jus multifruit, à base de jus et purée de fruits"
060201,2034,"Jus de clémentine ou mandarine, pur jus"
060201,2035,"Jus multifruit, pur jus, standard"
060201,2036,"Jus multifruit 0 base raisin, standard"
060201,2038,"Jus multifruit 0 base orange, standard"
060201,2039,"Jus de grenade, frais"
060201,2048,"Jus multifruit 0 base pomme, standard"
060201,2050,"Jus multifruit 0 base pomme, multivitaminé"
060201,2052,"Jus de fruit(s) et de légume(s), pur jus"
060201,2053,"Jus de tomate, pur jus (aliment moyen)"
060201,2069,"Jus multifruit, à base de concentré, standard"
060201,2070,"Jus d'orange, pur jus"
060201,2071,"Jus multifruit, à base de concentré, multivitaminé"
060201,2072,"Jus de fruits, pur jus (aliment moyen)"
060201,2073,"Jus d'ananas, pur jus"
060201,2074,"Jus de pomme, pur jus"
060201,2075,"Jus de légumes, pur jus (aliment moyen)"
060201,2077,"Jus de fruits, à base de concentré (aliment moyen)"
060201,2377,"Jus d'orange sanguine, pur jus"
060201,2500,Smoothie
060202,2009,"Nectar multifruit 0 base pomme, standard"
060202,2010,"Nectar multifruit 0 base pomme, multivitaminé"
060202,2043,Nectar d'abricot
060202,2045,Nectar de papaye
060202,2054,Nectar de poire
060202,2060,"Nectar multifruit, multivitaminé"
060202,2061,"Nectar multifruit, standard"
060202,2062,"Nectar multifruit 0 base orange, multivitaminé"
060202,2063,"Nectar multifruit 0 base orange, standard"
060202,2064,"Nectar, avec édulcorants, allégé en sucres"
060202,2076,Nectar de pomme
060202,2365,Nectar de fruit de la passion ou maracuja
060202,2366,Nectar de banane
060202,2367,Nectar de goyave
060202,2370,Nectar de mangue
060202,2371,Nectar de pêche
060202,2374,Nectar d'ananas
060202,2375,Nectar d'orange
060203,18001,"Boisson gazeuse, sans jus de fruit, non sucrée, avec édulcorants"
060203,18010,"Limonade, sucrée"
060203,18011,Eau de coco
060203,18012,"Boisson à l'eau minérale ou de source, aromatisée, sucrée"
060203,18013,"Tonic ou bitter, non sucré, avec édulcorants"
060203,18014,"Tonic ou bitter, sucré, avec édulcorants"
060203,18015,"Boisson au thé, aromatisée, sucrée, avec édulcorants"
060203,18016,"Limonade, sucrée, avec édulcorants"
060203,18018,"Cola, sucré"
060203,18019,"Boisson gazeuse aux fruits (de 10 à 50% de jus), sucrée"
060203,18021,"Boisson plate aux fruits, (à moins de 10% de jus), non sucrée, avec édulcorants"
060203,18023,"Boisson plate aux fruits (à moins de 10% de jus), sucrée"
060203,18024,"Boisson plate aux fruits (10 à 50% de jus de jus), sucrée, avec édulcorants"
060203,18025,Kombucha
060203,18026,"Boisson gazeuse, sans jus de fruit, sucrée"
060203,18028,"Boisson à l'eau minérale ou de source, aromatisée, non sucrée, sans édulcorant"
060203,18029,Boisson rafraîchissante sans alcool (aliment moyen)
060203,18030,"Boisson à l'eau minérale ou de source, aromatisée, non sucrée, avec édulcorants"
060203,18033,"Boisson gazeuse aux fruits (à moins de 10% de jus), sucrée, avec édulcorants"
060203,18034,"Boisson gazeuse aux fruits (de 10 à 50% de jus), sucrée, avec édulcorants"
060203,18035,"Limonade, non sucrée, avec édulcorants"
060203,18037,"Cola, sucré, avec édulcorants"
060203,18039,Diabolo (limonade et sirop)
060203,18048,"Boisson gazeuse aux fruits (teneur en jus non spécifiée), sucrée (aliment moyen)"
060203,18049,"Boisson gazeuse aux fruits (à moins de 10% de jus), sucrée"
060203,18051,"Boisson gazeuse aux fruits (de 10 à 50% de jus), non sucrée, avec édulcorants"
060203,18057,"Boisson préparée à partir de boisson concentrée à diluer, non sucrée, avec édulcorants"
060203,18058,"Boisson préparée à partir de sirop à diluer type menthe, fraise, etc, sucré, dilué dans l'eau"
060203,18060,"Cola, non sucré, avec édulcorants"
060203,18062,"Boisson au thé, aromatisée, teneur en sucre et édulcorant inconnue (aliment moyen)"
060203,18063,"Cola, teneur en sucre et édulcorant inconnue (aliment moyen)"
060203,18064,"Boisson au thé, aromatisée, à teneur réduite en sucres"
060203,18065,"Boisson au thé, aromatisée, non sucrée, avec édulcorants"
060203,18067,"Cola, sucré, sans caféine"
060203,18068,"Cola, non sucré, avec édulcorants, sans caféine"
060203,18075,"Boisson au thé, aromatisée, sucrée"
060203,18078,"Boisson gazeuse, sans jus de fruit, sucrée, avec édulcorants"
060203,18304,"Boisson plate aux fruits (10 à 50% de jus), à teneur réduite en sucres"
060203,18309,"Boisson plate aux fruits (teneur en jus non spécifiée), sucrée"
060203,18339,"Boisson plate aux fruits (10 à 50% de jus), sucrée"
060203,18340,"Boisson gazeuse aux fruits (à moins de 10% de jus), non sucrée, avec édulcorants"
060203,18341,"Boisson gazeuse à la pomme (de 50 à 99% de fruits), non sucrée"
060203,18344,"Tonic ou bitter, sucré"
060203,18345,"Boisson gazeuse aux fruits (à moins de 10% de jus), non sucrée, sans édulcorant"
060203,18352,"Boisson énergisante, sucrée"
060203,18353,"Boisson énergisante, non sucrée, avec édulcorants"
060204,18343,Boisson au jus de fruit et au lait
060204,19120,"Boisson lactée aromatisée (arôme inconnu), sucrée, au lait partiellement écrémé(aliment moyen)"
060204,19122,"Boisson lactée aromatisée au chocolat, sucrée, au lait partiellement écrémé"
060204,19127,"Boisson lactée aromatisée à la fraise, sucrée, au lait partiellement écrémé"
060205,18041,Lait de coco ou Crème de coco
060205,18107,"Boisson à l'amande, nature, non sucrée, non enrichie"
060205,18110,"Boisson à l'amande, sucrée, enrichie en calcium"
060205,18305,"Boisson plate aux fruits (10 à 50% de jus), non sucrée, avec édulcorants"
060205,18900,"Boisson au soja, nature, non enrichie"
060205,18901,"Boisson au soja, nature, enrichie en calcium"
060205,18902,"Boisson au soja, aromatisée, sucrée, non enrichie"
060205,18903,"Boisson au soja, aromatisée, sucrée, enrichie en calcium"
060205,18904,"Boisson au riz, nature"
060205,18905,"Boisson à base d'avoine, nature"
060205,18906,"Boisson à la châtaigne, nature"
060205,18907,"Boisson à la noix de coco, nature"
060205,29209,Boisson au soja et jus de fruits concentrés
060206,18004,"Café, non instantané, non sucré, prêt à boire"
060206,18020,"Thé infusé, non sucré"
060206,18022,"Tisane infusée, non sucrée"
060206,18070,"Café décaféiné, non instantané, non sucré, prêt à boire"
060206,18071,"Café expresso, non instantané, non sucré, prêt à boire"
060206,18072,"Café décaféiné, instantané, non sucré, prêt à boire"
060206,18073,"Café, instantané, non sucré, prêt à boire"
060206,18104,"Boisson cacaotée ou au chocolat, instantanée, sucrée, prête à boire"
060206,18106,"Boisson cacaotée ou au chocolat, instantanée, sucrée, enrichie en vitamines"
060206,18151,"Café au lait, café crème ou cappuccino, instantané ou non, non sucré, prêt à boire"
060206,18153,"Chicorée et café, instantané, non sucré, prête à boire"
060206,18154,"Thé noir, infusé, non sucré"
060206,18155,"Thé vert, infusé, non sucré"
060206,18156,"Thé oolong, infusé, non sucré"
060206,18161,"Chicorée, instantanée, non sucrée, prête à boire (reconstituée avec du lait demi0écrémé standard)"
060206,18162,"Chicorée et café, instantané, non sucré, prêt à boire (reconstituée avec de l'eau)"
060207,18003,"Café, moulu"
060207,18005,"Café, poudre soluble"
060207,18017,"Sirop à diluer, sucré"
060207,18059,"Boisson concentrée à diluer, sans sucres ajoutés, avec édulcorants, type ""sirop 0%"""
060207,18069,"Café, décaféiné, poudre soluble"
060207,18076,"Thé, feuille"
060207,18100,"Cacao, non sucré, poudre soluble"
060207,18101,"Poudre cacaotée ou au chocolat pour boisson, sucrée"
060207,18102,"Poudre maltée, cacaotée ou au chocolat pour boisson, sucrée, enrichie en vitamines et minéraux"
060207,18150,"Chicorée et café, poudre soluble"
060207,18152,"Chicorée, poudre soluble"
060207,18160,"Café au lait ou cappuccino, poudre soluble"
060207,18163,"Café au lait ou cappuccino au chocolat, poudre soluble"
060207,18167,"Poudre cacaotée ou au chocolat sucrée pour boisson, enrichie en vitamines et minéraux"
060207,18168,"Poudre cacaotée ou au chocolat pour boisson, sucrée, enrichie en vitamines"
060207,18220,"Citron ou Lime, spécialité à diluer pour boissons, sans sucres ajoutés"
060301,1006,Vin doux
060301,5100,Pétillant de fruits
060301,5201,Vin blanc mousseux
060301,5207,Champagne
060301,5209,Vin blanc mousseux aromatisé
060301,5210,Vin (aliment moyen)
060301,5214,Vin rouge
060301,5215,Vin blanc (sec)
060301,5216,Vin rosé
060302,5000,Bière brune
060302,5001,"Bière ""coeur de marché"" (405° alcool)"
060302,5002,Bière forte (>8° alcool)
060302,5003,Cidre (aliment moyen)
060302,5006,Cidre brut
060302,5007,Cidre doux
060302,5008,Bière faiblement alcoolisée (3° alcool)
060302,5009,Bière blanche
